id,question,choice_1,answer_1,choice_2,answer_2,choice_3,answer_3,choice_4,answer_4,choice_5,answer_5,media_exist,media_name,description
519,Kim oʻquv yurtlarida boshqarishni o'rgatish huquqiga ega?,Haydashni o'rgatish huquqini beruvchi xujjatlari boʻlgan haydashni o'rgatuvchi yo'riqchi,True,Tajribali haydovchi,False,3 yillik ishlagan davri bo'lgan haydovchi,False,5 yil haydovchilik ishlagan davriga ega bo'lgan 1- va 2-toifa haydovchilar,False,,,False,1,"YHQ 25-bobi 148-bandiga muvofiq, avtomototransport vositasini yoki shahar elektr transportini boshqarish bo'yicha amaliy mashg'ulotlar instruktori boshqarishni oʻrgatish huquqini beruvchi xujjatga, shuningdek, tegishli toifadagi haydovchilik guvohnomasiga ega bo'lishlari kerak."
520,"Yuk transport vositasining oʻlchamlaridan chiqib tursa, kunning qorong'i vaqtida va yetarli ko'rinmaydigan sharoitda qanday belgilanadi?",Ishora taxtachalari yoki bayroqchalar (diagonal bo'yicha navbatma-navbat tortilgan qizil va oq yo'lli) bilan,False,"Oldiga oq, orqasiga qizil, yon tomoni zarg'aldoq rang yorug'lik qaytargich moslamalar yoki fonarlar bilan",True,"Orqasiga qizil, oldiga oq bayroqchalar bilan",False,,,,,False,1,"YHQ 27-bobi 163-bandiga muvofiq, transport vositasining gabaritlaridan old yoki orqa tomonga bir metrdan, gabarit chiroqlarining chetki qismidan 0,4 metrdan ortiq chiqib turgan yuk, «Katta o'lchamli yuk» belgisi bilan belgilanishi, qorong'i vaqtda va yetarlicha koʻrinmaslik sharoitida esa bunga qo'shimcha qilib oldi oq chiroq yoki yorug'lik qaytargich, orqasi esa qizil chiroq yoki yorugʻlik qaytargich bilan belgilanishi kerak."
521,'Ruxsat etilgan to'la vazn' nima?,Transport vositasining yuk ko'tarishi,False,Transport vositasining haqiqiy vazni,False,"Ishlab chiqaruvchi korxona tomonidan belgilangan, aslahalangan transport vositasining haydovchi, yo'lovchi, yuk bilan birga ruxsat etilgan eng yuqori vazni (miqdori)",True,Transport vositisida tashiladigan yukning ishlab chiqargan korxona yo'l qo'ygan texnik tavsifnomasi sifatida belgilanadigan vazni,False,,,False,1,"YHQ 1-boʻlim 6-bandini 32-izohiga asosan, «Ruxsat etilgan to'la vazn» – aslahalangan transport vositasining yuki, haydovchi va yo'lovchilari bilan birga, ishlab chiqaruvchi korxona tomonidan belgilangan eng yuqori vazni (miqdori)."
522,Bu belgida harakatlanish ruxsat etiladi:,Faqat avtomobil haydovchisiga,False,Faqat avtomobil va mototsikl haydovchilariga,False,Barcha transport vositalarining haydovchilariga,True,Faqat avtomobil va avtobus haydovchilariga,False,,,True,522,"YHQ 1-ilovasining 4-boʻlimidagi 4.4 «Yengil avtomobillar harakati» belgisida yengil avtomobil ifodalangan bo'lsa ham, belgi yengil avtoomobillardan tashqari barcha turdagi avtobuslar, mototsikllar va to'la vazni 3,5 tonnadan kam boʻlgan yuk avtomobillarining harakatlanishiga ruxsat etib, to'la vazni 3,5 tonnadan yuqori bo'lgan yuk avtomobillari va traktorlar harakatlanishini taqiqlaydi. - Belgining ta'sir oralig'ida yashovchi va ishlovchi fuqarolarga tegishli, ularga va korxonalarga xizmat ko'rsatuvchi transport vositalariga bu belgi tadbiq etilmaydi."
523,Avtomagistralda qatnov qismining chetini bildiruvchi sidirg'a oq chiziqni bosib o'tishga ruxsat etiladimi?,Ruxsat etiladi,True,Taqiqlanadi,False,"Agar avtomagistralda harakatlanish serqatnov boʻlsa, taqiqlanadi",False,,,,,True,523,"YHQ 2-ilovasining 1-boʻlimidagi 1.2 chizig'i avtomagistrallarda qatnov qismining chekkasiga chizilgan enli (20 sm) uzluksiz sidirgʻa chiziq qatnov qismining chegarasini bildiradi. 1.2, 1.5-1.8 chiziqlarni hohlagan tarafdan kesib o'tishga ruxsat etiladi."
524,Transport vositalari chorrahani quyidagi tartibda kesib oʻtadilar:,"Yashil avtomobil ayni vaqtda 2-tramvay bilan, 1- tramvay, ko'k, sariq, qizil avtomobillar",False,"1- va 2- tramvaylar ayni vaqtda sariq avtomobil bilan, yashil, ko'k, qizil avtomobillar",True,,,,,,,True,524,"YHQ 16-bobi 104, 106-bandlariga muvofiq, teng ahamiyatga ega bo'lmagan yo'llar kesishgan chorrahada, keyingi harakat yo'nalishidan qat'i nazar, asosiy yo'ldan kelayotgan transport vositasiga ikkinchi darajali yo'ldan kelayotgan transport vositasining haydovchisi yo'l berishi kerak."
525,Harakatlanishga ruxsat etilgan barcha transport vositalari qaysi javobda ko'rsatilgan?,Tramvay va mototsikl,False,Avtomobillar va mototsikl,False,Barcha transport vositalari,True,"Tramvay, yuk avtomobili va mototsiki",False,,,True,525,"YHQ 7-bobi 32-bandiga muvofiq, yo'naltirgich ko'rinishidagi qizil, sariq va yashil rangli svetofor ishoralari ham doira shaklidagi svetofor ishoralari bilan bir xil ma'noga ega bo'ladi. Ular faqat ko'rsatilgan yo'nalishga ta'sir etadi. Agar tegishli yo'l belgisi bilan taqiqlanmagan boʻlsa, chapga burilishga ruxsat beruvchi yo'naltirgich qayrilib olishga ham ruxsat beradi. Qo'shimcha tarmoqdagi yashil yo'naltirgich ham xuddi shu ma'noni bildiradi. Qo'shimcha tarmoqdagi ishora o'chirilgan bo'lsa, shu tarmoq tartibga solayotgan yoʻnalishda harakatlanish taqiqlanganligini bildiradi."
526,Aholi punktlarida ma'lum harakat tezligiga rioya etayotgan yirik oʻlchamli transport vositasining haydovchisi qanday yo'l tutishi kerak?,To'xtashi va orqasida to'planib qolgan transport vositalarini o'tkazib yuborishi,False,Harakatni davom ettirishi kerak,True,,,,,,,True,526,"YHQ 12-bobi 87-bandiga muvofiq, aholi punktlaridan tashqaridagi yo'llarda sekin harakatlanadigan yoki katta hajmli transport vositasini quvib oʻtish qiyin bo'lgan hollarda uning haydovchisi ushbu transport vositasini iloji boricha yo'lning o'ng tomoniga olishi, zarur bo'lganda esa orqasida to'planib qolgan transport vositalarini o'tkazib yuborish uchun to'xtashi kerak."
527,Mazkur vaziyatda quvib o'tishga ruxsat etilganmi?,40 km/soatdan kam tezlik bilan harakatlanayotgan faqat yakka transport vositalariga ruxsat etilgan,False,Taqiqlangan,True,Barcha hollarda ruxsat etilgan,False,,,,,True,527,"YHQ 12-bobi 86-bandi 4-xatboshiga asosan, quvib o'tish quyidagi hollarda taqiqlanadi: temir yo'l kesishmalarida va ulargacha 100 metrdan kam masofa qolganda."
528,"Siz chapga burilishga yoki qayrilishga qaror qildingiz. Orqani ko'rsatadigan koʻzguga qarab bildingizki, ortingizdagi haydovchi Sizni quvib o'tmoqchi. Sizning bundan keyingi harakatingiz?","Burilishning chap ko'rsatkichini yoqish va qatnov qismida qulay joylashib olishdan foydalanib, manyovr qilishga kirishish",False,Sizning ortingizdan kelayotgan haydovchi Sizni quvib o'tib ketgandan so'nggina burilishning chap ko'rsatkichini yoqish,True,"Burilishning chap ko'rsatkichini yoqish, oʻzini quvib oʻtishga imkon berishi va so'ng manyovr qilishga kirishish",False,,,,,False,1,"YHQ 12-bobi 84-bandiga muvofiq, quvib oʻtilayotgan transport vositasining haydovchisiga harakat tezligini oshirish yoki boshqa xatti-harakatlar bilan quvib o'tishga to'sqinlik qilish taqiqlanadi."
529,"Oʻng va chap g'ildiraklarining shinalari turlicha siyqalangan avtomobilda tormoz berish, qanday xavfli oqibatlarga olib kelishi mumkin?",Tormoz barabanlarining qizib ketishiga,False,Naqsh izlarining ko'chib ketishiga,False,Avtomobilning ag'darilib ketishi mumkin darajada sirpanib ketishiga,True,,,,,False,1,"Bir o'qda o'rnatilgan (chap va o'ng) shinalar naqshining ustki shakli va uning yeyilganlik darajasi barcha hollarda bir xil boʻlishi lozim, chunki bu hol tormozlanayotganda avtomobilning muvozanatini ta'minlovchi shartlardan biri hisoblanadi. Ushbu tartib inobatga olinmasa tormozlanish vaqtida har xil tormoz kuchlari yuzaga kelib, muvozanatni yo'qotishga olib keluvchi hollarni vujudga keltiradi. Avtomobilning naqshi yeyilgan shina tomoni oldinga intilib, aks tomoni orqada qoladi. Bu holda avtomobil bir tomonga siljib, maqbul bo'lmagan sharoitlarda muvozanatini yo'qotib, ag'darilishi mumkin."
530,Yoʻlovchi tashishga mo'ljallanmagan yuk avtomobilida yukni kuzatib boruvchi yoki qabul qilib oluvchi shaxslarning tashilishiga ruxsat beriladimi?,Agar bort balandligidan pastda joylashgan qulay o'rindiq bo'lsa ruxsat beriladi,True,Taqiqlanadi,False,,,,,,,False,1,"YHQ 26-bobi 156-bandiga muvofiq, odam tashishga moslashtirilmagan yuk avtomobillarining yukxonasida faqat yukni olish uchun borayotgan yoki uni kuzatib borayotgan shaxslarning bo'lishiga yo'l qo'yiladi, bunda ular bortlardan pastda joylashgan o'rindiqlar bilan ta'minlanishlari kerak."
531,Quvib o'tish nima?,Egallagan harakatlanish bo'lagidan chiqib oldinda ketayotgan transport vositasidan o'zib ketish,True,"Qarama-qarshi harakat bo'lagiga chiqish va keyinchalik avval egallangan bo'lakka qaytish bilan bogʻliq boʻlib, bir yoki bir qancha transport vositalaridan o'zib ketish",False,Kam tezlik bilan qo'shni qatorda harakatlanayotgan bir yoki bir qancha transport vositalaridan o'zib ketish,False,,,,,False,1,"YHQ 1-boʻlim 6-bandi 44-izohga koʻra, quvib o'tish - egallagan harakatlanish bo'lagidan chiqib oldinda ketayotgan transport vositasidan o'zib ketish."
532,Qaysi belgi yo'lning bir tomonlamali harakatlanish yo'l qismini koʻrsatadi?,1,False,2,False,3,True,4,False,5,False,True,532,YHQ 1-ilovasining 5-bo'limidagi 5.5 «Bir tomonlama harakatli yoʻl» belgisi tor ko'cha va yoʻllarda harakat xavfsizligini ta'minlash maqsadida transport vositalarining harakatini yo'lning qatnov qismi bo'yicha bir tomonlama joriy etish uchun ushbu yo'l belgisidan foydalaniladi.
533,"Haydovchi, agar uning transport vositasi 40 km/soatga teng yoki undan ortiq tezlik bilan balandlikka chiqa olmasa, nima chora ko'rishi kerak?","Asosiy bo'lak bo'yicha, agar unda boshqa transport vositalari yo'q bo'lsa, harakatlanishni davom ettirishi",False,Qo'shimcha bo'lakka qayta tizilishi,True,"Agar balandlikning davomliligi 30 metrdan oshmasa, asosiy bo'lak bo'yicha harakatlanishni davom ettirishi",False,,,,,True,533,"YHQ 1-ilovasining 5-boʻlimidagi 5.8.3 «Boʻlakning boshlanishi» belgisi yo'lning balandlikka ko'tariladigan qismlarida og'ir yuk avtomobillari va sekin yuradigan transportlar boshqa transport vositalariga xalaqit bermasligi uchun, ularga qo'shimcha bo'lak ajratilib, bo'lak boshlanish joyiga ushbu belgi oʻrnatiladi, bo'lak oxiriga esa «5.8.5. «Bo'lak oxiri» belgisi oʻrnatiladi. Agar qo'shimcha bo'lak oldiga 4.7. «Eng kam tezlik» belgisi o'rnatilgan bo'lsa, ko'rsatilgan yoki undan kattaroq tezlikda harakatlana olmaydigan transport vositasining haydovchisi asosiy bo'lakdan qo'shimcha bo'lakka qayta tizilishi kerak"
534,Avtomobillar chorrahani quyidagi tartibda kesib o'tadilar:,"Sariq chorrahaga chiqadi va yashilni o'tkazib yuborish uchun to'xtaydi; yashil, ko'k ayni vaqtda qizil bilan; sariq",False,"Ko'k ayni vaqtda qizil bilan; yashil, sariq",False,"Yashil; ko'k ayni vaqtda qizil, so'ng sariq,",True,,,,,True,534,"YHQ 16-bobi 105-bandiga muvofiq, teng ahamiyatga ega boʻlgan yoʻllar kesishgan chorrahada relssiz transport vositasining haydovchisi o'ngdan kelayotgan transport vositalariga yo'l berishi shart. Bu qoidaga tramvay haydovchilari ham oʻzaro amal qilishlari kerak. Bunday chorrahalarda, keyingi harakat yo'nalishidan qat'i nazar, tramvay relssiz transport vositalariga nisbatan oldin o'tish huquqiga ega bo'ladi."
535,Qaysi rasmda haydovchi o'ngga to'g'ri burilyapti?,1,True,2,False,,,,,,,True,535,"YHQ 7-bobi 32-bandiga asosan, yoʻnaltirgich koʻrinishidagi qizil, sariq va yashil rangli svetofor ishoralari ham doira shaklidagi svetofor ishoralari bilan bir xil ma'noga ega bo'ladi. Ular faqat ko'rsatilgan yo'nalishga ta'sir etadi. Agar tegishli yo'l belgisi bilan taqiqlanmagan bo'lsa, chapga burilishga ruxsat beruvchi yo'naltirgich qayrilib olishga ham ruxsat beradi. Qoʻshimcha tarmoqdagi yashil yo'naltirgich ham xuddi shu ma'noni bildiradi. Qo'shimcha tarmoqdagi ishora oʻchirilgan boʻlsa, shu tarmoq tartibga solayotgan yoʻnalishda harakatlanish taqiqlanganligini bildiradi."
536,Qaysi transport vositasining haydovchisi toʻxtash qoidasini buzdi?,Faqat mototsikl haydovchisi,True,Faqat avtomobil haydovchisi,False,Har ikkisi buzdi,False,Hech kim buzmadi,False,,,True,536,"YHQ 22-bobi 132-bandi 3-xatboshiga asosan, boʻlak yo'l qatnov qismining o'ng chekkasida joylashgan boʻlib, qo'shni chap boʻlakdan uzuq-uzuq chiziq bilan ajratilgan bo'lsa, u holda bu bo'lakka, istisno tariqasida, belgilangan yo'nalishdagi transport vositasiga xalaqit bermaslik sharti bilan yo'lning o'ng chekkasida yo'lovchilarni chiqarish va tushirish uchun harakatlanib kirishlari mumkin."
537,Qizil avtomobil haydovchisiga tramvay yo'li bo'yicha harakatlanishga ruxsat etiladimi?,Ruxsat etiladi,True,Taqiqlanadi,False,,,,,,,True,537,"YHQ 10-bobi 69-bandiga muvofiq, to'g'ri yo'nalishdagi qatnov qismining chap tomonida u bilan bir sathda joylashgan tramvay izidan shu yo'nalishdagi boshqa bo'laklar band bo'lganda harakatlanishga, aylanib va quvib o'tishga, shuningdek, chapga burilish va qayrilib olishga ruxsat etiladi. Biroq bu manyovr tramvay harakatiga xalaqit bermasligi kerak."
538,Chiziqlar bilan boʻlaklarga ajratilgan yoʻlning qatnov qismida transport vositalarining harakatlanishi qanday amalga oshirilishi kerak?,"Qat'iy bo'laklar bo'yicha, uzuq-uzuq chiziqni kesib oʻtishga faqat qayta tizilishda ruxsat etiladi",True,"Agar qatnov qismi transport vositalaridan xoli bo'lsa, bo'lak bo'yicha qat'iy emas",False,"Agar transport vositalarining o'lchamlari eniga katta bo'lmasa, bo'lak bo'yicha qat'iy emas",False,"Agar qatnov qismida tirkamali avtomobillar boʻlmasa va bunda ancha tor harakat oralig'ini saqlash mumkin bo'lsa, bo'laklar bo'yicha qat'iy emas",False,,,False,538,"YHQ 10-bobi 70-bandiga muvofiq, agar qatnov qismi yo'l chiziqlari bilan bo'laklarga ajratilgan boʻlsa, transport vositalarining harakatlanishi qat'iy ravishda belgilangan bo'laklarda amalga oshirilishi kerak. Faqat qayta tizilishda uzuq-uzuq chiziqlarni bosib oʻtishga ruxsat etiladi."
539,Boldir suyagi oʻrtasidan singanda transportda tashish uchun taxtakach yoki uning o'rnini o'tovchi narsa qanday qo'yiladi?,Singan joyga qo'yiladigan shina yoki uning o'rnini bosuvchi narsani siqib bogʻlash kerak,False,Shinani ikki tomondan butun boldir uzunligida tovondan to tizza boʻgʻinigacha qo'yish kerak,False,"Tovon tagidan to son o'rtasigacha oyoqning ichki va tashqi tomonidan ikkita shina qo'yish kerak. Singan joyni, tizza va boldir-oyoq kafti bo'g'inlarini qimirlatmaslik lozim",True,,,,,False,1,"Suyak siniqlarining bir biriga nisbatan qoʻzgʻalmasligini ta'minlash uchun boldirni ikki taxtakach orasida mahkamlab, boldir-tovon bo'g'in va tizza boʻgʻinining harakatini chegaralash lozim."
540,Qanday shartlarda transport vositalaridan foydalanish taqiqlanadi?,Faralar yoritishi buzilgan boʻlsa,False,Tashqi yoritish asboblari va yorugʻlik qaytargichlar ifloslanganda,False,Yoritish asboblari o'rnida mazkur yoritish asboblarining turiga mos kelmaydigan lampalardan foydalanilganda,False,Sanab oʻtilgan barcha hollarda,True,,,False,1,"YHQ 3-ilovasining 3-bo'limidagi 3.2.,3.3.,3.4-bandlariga asosan, yorituvchi fara nurining yo'nalishi buzilgan bo'lsa, agar tashqi yoritgichlar va nur qaytargichlar belgilangan tartibda ishlamayotgan yoki ifloslangan bo'lsa, yoritish asboblaridan nur sochuvchisi bo'lmasa yoxud nur sochuvchi va lampalar tegishli yorugʻlik asboblari turiga mos bo'lmaganida foydalanilgan bo'lsa, transport vositalaridan foydalanishga ruxsat berilmaydi."
541,Mazkur belgi nima haqida axborot beradi?,Trolleybus yoki avtobus to'xtash joylarini bildiradi,True,Marshrutdan boshqa barcha transport vositalariga yoʻlning o'ng qatori bo'yicha harakatlanishni taqiqlaydi,False,,,,,,,True,541,YHQ 1-ilovasining 5-boʻlimi 5.12 belgi «Avtobus va trolleybus to'xtash joyi» belgisidir.
542,Qaysi belgi shlagbaumli temir yo'l kesishmasiga yaqinlashganlik haqida ogohlantiradi?,1,False,2,False,3,False,4,True,5,False,True,542,YHQ 1-ilovasining 1-bo'limidagi 1.1 «Shlagbaumli temir yo'l kesishmasi» belgisi shlagbaum bilan jihozlangan temir yo'l kesishmasiga yaqinlashayotganligi haqida ogohlantiradi.
543,Bu belgida yuk avtomobillaridan qaysi biriga harakatlanishni davom ettirishga ruxsat etiladi?,Yukxonasida odamlar bo'lgan maxsus moslashtirilgan yuk avtomobillarga,True,Furgon-yukxonada mahsulotlar tashiydigan avtomobillarga,False,'Aloqa' yozuvi bo'lgan avtomobillarga,False,,,,,True,543,"YHQ 1-ilovasining 3-boʻlimidagi 3.4 belgi talabiga muvofiq, «Yuk avtomobillarining harakatlanishi taqiqlangan» belgida cheklangan vazn koʻrsatilmagan bo'lsa, bu belgi to'la vazn 3,5 tonnadan yuqori bo'lgan barcha yuk avtomobillarining, barcha traktorlarning, o'zi yurar mashina va mexanizmlarning harakatlaninshini taqiqlaydi. Bu belgi ta'sir oralig'ida yashovchi va ishlovchilarga daxldor emas, shuningdek, bortlariga qiya oq chiziq tortilgan yoki odamlarni tashiyotgan yuk avtomobillarining harakatlanishini taqiqlamaydi."
544,"Zanjirli bo'lgan qishloq xo'jalik, yo'l qurilishi va boshqa mexanik transport vositalariga temir yo'l kesishmasidan oʻtishga ruxsat etiladimi?","Agar temir yo'l boshlig'ining ruxsati boʻlsa, ruxsat etiladi",False,Mexanik transport vositalariga yuklab olib oʻtish ruxsat etiladi,True,Taqiqlanadi,False,,,,,False,1,"YHQ 18-bobi 118-bandi 8-xatboshiga asosan, temir yoʻl kesishmasi orqali zanjirli (qishloq xo'jaligi, yo'l qurilishi va h.k.) mashina va mexanizmlarning yurib o'tishi (mexanik transport vositalariga yuklab olib o'tishga ruxsat etiladi)."
545,Harakatlanish qaysi yo'nalishda ruxsat etilgan?,Toʻgʻriga va oʻngga birinchi yo'nalishga,False,O'ngga birinchi yo'nalishga,True,O'ngga ikkinchi yo'nalishga,False,O'ngga birinchi va ikkinchi yo'nalishga,False,,,True,545,"YHQ 7-bobi 32-bandi 2-xatboshiga muvofiq, yo'naltirgich ko'rinishidagi qizil, sariq va yashil rangli svetofor ishoralari ham doira shaklidagi svetofor ishoralari bilan bir xil ma'noga ega bo'ladi. Ular faqat ko'rsatilgan yo'nalishga ta'sir etadi. Agar tegishli yo'l belgilari bilan qayrilib olish ta'qiqlanmagan bo'lsa chapga burilishga ruxsat beruvchi yo'naltirgich, qayrilib olishga ham ruxsat beradi. Qo'shimcha tarmoqdagi yashil yo'naltirgich ham xuddi shu ma'noni bildiradi."
546,Chorrahani oxiri kesib o'tadi:,Qizil avtomobil,False,Ko'k avtomobil,False,Yashil avtomobil,True,,,,,True,546,"YHQ 16-bobi 104-bandiga muvofiq, teng ahamiyatga ega bo'lmagan yo'llar kesishgan chorrahada, keyingi harakat yo'nalishidan qat'i nazar, asosiy yo'ldan kelayotgan transport vositasiga ikkinchi darajali yo'ldan kelayotgan transport vositasining haydovchisi yo'l berishi kerak. YHQ 16-bobi 107-bandiga muvofiq, chapga burilishda yoki qayrilib olishda relssiz transport vositasining haydovchisi teng ahamiyatli yo'ldan qarama-qarshi yo'nalishdan toʻgʻriga yoki o'ngga harakatlanayotgan, shuningdek, ruxsat etilgan hollarda quvib o'tayotgan transport vositalariga yo'l berishi shart. Bu qoidaga tramvay haydovchilari ham o'zaro amal qilishlari kerak."
547,Bu yo'l belgisi:,Ikki g'ildirakli kajavasiz mototsikllardan tashqari hamma mexanik transport vositalarining harakatlanishini taqiqlaydi,False,G'ildirakli traktorlardan tashqari hamma transport vositalarining harakatlanishini taqiqlaydi,False,Traktorlar va o'zi yurar mashinalarning harakatlanishi taqiqlanadi,True,,,,,True,547,"YHQ 1-ilovasining 3-boʻlimidagi 3.6 belgi talabiga muvofiq, «Traktorlar harakatlanishi taqiqlangan» belgisi barcha turdagi traktorlar, oʻzi yurar mashina va mexanizmlarning harakatlanishini taqiqlaydi."
548,Transport vositalari chorrahadan quyidagi tartibda o'tadilar:,"Ko'k avtomobil, tramvay, qizil avtomobil",True,"Tramvay, qizil, so'ngra ko'k avtomobil",False,"Tramvay, ko'k avtomobil chorrahaga chiqadi, qizilga yo'l beradi, so'ngra burilishni tugallaydi",False,,,,,True,548,"YHQ 16-bobi 104-bandiga muvofiq, teng ahamiyatga ega boʻlmagan yo'llar kesishgan chorrahada, keyingi harakat yo'nalishidan qat'i nazar, asosiy yo'ldan kelayotgan transport vositasiga ikkinchi darajali yo'ldan kelayotgan transport vositasining haydovchisi yo'l berishi kerak. YHQ 16-bobi 107-bandiga muvofiq, Asosiy yoʻlning yo'nalishi chorrahada oʻzgarganda, asosiy yoʻlda harakatlanayotgan haydovchilar oʻzaro teng ahamiyatli yo'llar chorrahasidan oʻtish qoidasiga amal qilishlari kerak. Ikkinchi darajali yo'llarda harakatlanayotgan haydovchilar ham oʻzaro shu qoidaga amal qilishlari lozim."
549,Egiluvchan ulagichda shatakka olganda transport vositalari orasidagi masofa qanday bo'lishi kerak?,1-3 m,False,2-4 m,False,3-6 m,False,4-6 m,True,4-8 m,False,False,1,YHQ 24-boʻlim 144-bandiga muvofiq egiluvchan ulagich bilan shatakka olishda shatakka olgan va shatakka olingan transport vositalari o'rtasidagi masofa 4-6 metr oralig'ida bo'lishi kerak. Egiluvchan ulagich qoidalarning 177-bandi talablariga binoan belgilanishi kerak.
550,"Qanday nosozlik bo'lganda, transport vositalarining harakatlanishni davom ettirishi taqiqlanadi?",Transport vositalarining tuzilishida ko'zda tutilgan oyna yuvgichlari ishlamaydi,False,Tashqi yoritish asboblari va yorugʻlik qaytargichlar belgilangan tartibda ishlamaydi yoki ifloslangan,False,Yomg'ir yoki qor yog'ayotgan vaqtda haydovchi tomonidagi oyna tozalagich ishlamaydi,True,Sanab o'tilgan barcha hollarda,False,,,False,1,"YHQ 2-bobi 12-bandi 3-xatboshiga asosan, haydovchiga: transport vositasining tormoz tizimi yoki boshqaruvi ishdan chiqsa, ulagich moslamasi (avtopoyezd tarkibida) nosoz bo'lsa, qorong'i vaqtda yoki yetarlicha koʻrinmaslik sharoitida faralar va orqa gabarit chiroqlari yonmasa, yomg'ir, qor yog'ayotgan vaqtda esa haydovchi tomonidagi oyna tozalagich ishlamay qolsa, bunday transport vositalarini harakatlanishi tagiglanadi."
551,Yonilg'i quyish joyidan yo'lga chiqish chorraha hisoblanadimi?,Hisoblanmaydi,True,Hisoblanadi,False,,,,,,,False,1,"YHQ 1-bob 6-bandi 11-izohga asosan, «Yondosh hudud» – bevosita yo'lga tutashgan va transport vositalari o'tib ketishi uchun mo'ljallanmagan hudud (hovlilar, turar joy dahalari, avtomobillarning to'xtab turish joylari, yonilg'i quyish tarmoqlari, korxona va h.k.). Yondosh hududdan chiqish joylari chorraha xisoblanmaydi."
552,Qaysi belgi 'Mehmonxona'ni bildiradi?,1,False,2,False,3,True,4,False,5,False,True,552,YHQ 1-ilovasining 6-bo'limidagi 6.9 belgi «Mehmonxona» belgisidir.
553,Belgilarning ta'siri qaysi transport vositalariga tatbiq etiladi?,Faqat yengil avtomobillarga,False,Yengil avtomobillarga va mototsikllarga,False,"Yengil avtomobillarga va ruxsat etilgan to'la vazni 3,5 tonnadan kam yoki teng bo'lgan yuk avtomobillariga",True,,,,,True,553,"YHQ 1-ilovasining 7-boʻlimidagi 7.4.3 qo'shimcha belgiga muvofiq, yengil avtomobil surati tasvirlangan «7.4.3» belgi to'la vazni 3,5 tonnagacha bo'lgan yuk avtomobillariga ham taalluqli."
554,Chorrahani oxirgi boʻlib kim kesib o'tadi?,Qizil avtomobil,True,Ko'k avtomobil,False,Yashil avtomobil,False,,,,,True,554,"YHQ 16-bobi 105-bandiga muvofiq, teng ahamiyatga ega bo'lgan yoʻllar kesishgan chorrahada relssiz transport vositasining haydovchisi o'ng tomondan yaqinlashib kelayotgan transport vositalariga yo'l berishi shart. Bu qoidaga tramvay haydovchilari ham o'zaro amal qilishlari kerak. Bunday chorrahalarda, keyingi harakat yo'nalishidan qat'i nazar, tramvay relssiz transport vositalariga nisbatan oldin o'tish huquqiga ega bo'ladi."
555,Qizil avtomobil chorrahani kesib o'tadi:,Birinchi bo'lib,True,Ikkinchi boʻlib,False,,,,,,,True,555,"YHQ 15-bobi 99-bandiga muvofiq, svetoforning yashil ishorasida chapga burilayotgan yoki qayrilib olayotgan relssiz transport vositasining haydovchisi qarama-qarshi tomondan to'g'riga harakatlanayotgan va o'ngga burilayotgan transport vositalariga yo'l berishi shart."
556,Shaharlararo qatnaydigan avtobusning haydovchisiga aholi punktlaridan tashqarida tezlikni 80 km/soatdan oshirishga ruxsat etiladimi?,Faqat shu yo'nalishda harakatlanish uchun ikki yoki undan ortiq bo'lak bo'lgan yo'llarda harakatlanganda ruxsat etiladi,False,Ruxsat etiladi,True,Taqiqlanadi,False,,,,,False,1,"YHQ 11-bobi 79-bandiga asosan, aholi punktlaridan tashqarida shaharlararo qatnaydigan avtobuslarga va mikroavtobuslarga tezlikni soatiga 90 kilometrdan oshirmasdan harakatlanishga ruxsat etiladi."
557,Bu joyda to'xtashga ruxsat etilganmi?,Ruxsat etilgan,False,Taqiqlangan,True,,,,,,,True,557,"YHQ 2-ilovasining 1-boʻlimidagi 1.4 chizig'i yoʻlning harakatlanish qismi chetiga yoki yo'l chetidagi to'siqqa (bordyurga) chizilgan sariq chiziq boʻlib, transport vositalarining toʻxtashini taqiqlaydi."
558,"Aholi punktidan tashqarida transport vositalarining uzoq to'xtab turishi (dam olish, tunash va hokazo)ga qayerda ruxsat etiladi?",Yo'l chetida,False,Toʻxtab turish maydonchalarida yoki yo'ldan tashqarida,True,"Yo'l qatnov qismining o'ng tomonida, biroq u boshqa transport vositalarining harakatlanishiga to'sqinlik qilmasligi kerak",False,"Yoʻlning chap tomonida, biroq harakat xavfsizligi choralariga rioya qilgan holda",False,,,False,1,"YHQ 13-bobi 90-bandiga muvofiq, aholi punktlaridan tashqarida tunab qolish, dam olish yoki boshqa maqsadlarda to'xtab turish faqat buning uchun ko'zda tutilgan maydonchalarda yoki yo'ldan tashqarida ruxsat etiladi."
559,Shatakka olish qanday hollarda taqiqlangan?,Sirpanchiqda qattiq ulagichda,False,Sirpanchiqda egiluvchan ulagichda,True,Yon kajavali mototsikllar bilan,False,,,,,False,1,"YHQ 24-bobi 145-bandiga asosan, yo'l yaxmalak, sirpanchiq bo'lgan hollarda egiluvchan ulagichda shatakka olish taqiqlanadi."
560,Ushbu yotiq chiziqlardan qaysi biri belgilangan yo'nalishdagi transport vositalari uchun to'xtashga ruxsat beradi?,A,False,B,False,V,False,"A, B, V",True,,,True,560,"YHQ 2-ilovasining 1-boʻlimidagi 1.17 belgi sariq rangdagi, arrasimon chiziq belgilangan yo'nalishli transport vositalari hamda taksilarning to'xtab turish joyini bildiradi."
